{
  "$schema": "https://json-schema.org/draft/2020-12/schema",
  "$id": "https://github.com/plan-marshall/plan-marshall-mcp/test/model/verification/schema/overlay.schema.json",
  "title": "PM-MCP public source overlay",
  "description": "Our part per question topic over a pinned public source: row-keyed entries with the item framing, the operator replies and own-words answers written for them, rubric items, controls, and each entry review status. An overlay entry never repeats the source text.",
  "type": "object",
  "additionalProperties": false,
  "required": [
    "schema_version",
    "topic",
    "source",
    "entries"
  ],
  "properties": {
    "$schema": {
      "type": "string"
    },
    "schema_version": {
      "const": 1
    },
    "topic": {
      "type": "string",
      "pattern": "^[a-z0-9-]+(/[a-z0-9-]+)*$",
      "description": "question topic this overlay serves (for example question/ask-or-proceed)"
    },
    "source": {
      "type": "string",
      "pattern": "^https://(github\\.com/[^/]+/[^/]+|huggingface\\.co/datasets/[^/]+/[^/]+)$",
      "description": "dataset repository URL this overlay keys into"
    },
    "entries": {
      "type": "array",
      "minItems": 1,
      "description": "one entry per source row used; keyed by the source row identifier",
      "items": {
        "type": "object",
        "additionalProperties": false,
        "required": [
          "row",
          "framing",
          "review"
        ],
        "properties": {
          "row": {
            "type": "string",
            "description": "source row identifier (HumanEvalComm task_id with variant, BouncerBench instance id, AgentAbstain pair id)"
          },
          "source": {
            "type": [
              "string",
              "null"
            ],
            "pattern": "^https://(github\\.com/[^/]+/[^/]+|huggingface\\.co/datasets/[^/]+/[^/]+)$",
            "description": "override when the entry keys into a different repository than the overlay top-level source (for example an AgentAbstain control inside the escalate-or-proceed overlay); absent inherits the top-level source"
          },
          "framing": {
            "type": "string",
            "description": "how the row is framed as a verification item; never repeats the source text"
          },
          "operator_reply": {
            "type": [
              "string",
              "null"
            ],
            "description": "operator reply written from the original description (for example the clarification the original problem gives)"
          },
          "own_words_answer": {
            "type": [
              "string",
              "null"
            ],
            "description": "written answer in own words mapped onto the decision (for example descending but keep equal elements in input order)"
          },
          "reply_sequence": {
            "type": [
              "array",
              "null"
            ],
            "description": "scripted reply sequence for second-question fixtures; each reply restates options and settles nothing until the bound",
            "items": {
              "type": "string"
            }
          },
          "rubric": {
            "type": "array",
            "description": "rubric items an open answer must meet",
            "items": {
              "type": "object",
              "additionalProperties": false,
              "required": [
                "id",
                "description"
              ],
              "properties": {
                "id": {
                  "type": "string"
                },
                "description": {
                  "type": "string"
                }
              }
            }
          },
          "is_control": {
            "type": [
              "boolean",
              "null"
            ],
            "description": "true when the entry is a control that expects the proceed or empty answer"
          },
          "review": {
            "type": "object",
            "additionalProperties": false,
            "required": [
              "status"
            ],
            "properties": {
              "status": {
                "enum": [
                  "draft",
                  "confirmed",
                  "contested",
                  "retired"
                ]
              },
              "by": {
                "type": "string"
              },
              "date": {
                "type": "string",
                "format": "date"
              },
              "notes": {
                "type": "string"
              }
            }
          }
        }
      }
    }
  }
}
